{
  "schemaVersion": "1.0",
  "title": "Expected cost of change",
  "subtitle": "ML-estimated operational exposure for ECO-1847",
  "currency": "USD",
  "locale": "en-US",
  "defaultScenarioId": "likely",
  "metadata": {
    "modelName": "ICX Change Impact Model",
    "modelVersion": "2.4.1",
    "predictedAt": "2026-07-24T18:30:00-04:00",
    "trainingWindow": "36 months",
    "similarChanges": 428
  },
  "scenarios": [
    {
      "id": "likely",
      "label": "Likely",
      "badge": "P50 scenario",
      "expectedCost": 184000,
      "range": { "low": 112000, "p50": 184000, "high": 296000 },
      "confidence": { "score": 78, "label": "Strong comparable history" },
      "interpretation": "Most exposure is concentrated in production disruption and inventory already in motion.",
      "scheduleRisk": {
        "label": "Include schedule-risk uplift",
        "upliftPercent": 18,
        "description": "Applies modeled downstream cost when implementation threatens committed production."
      },
      "drivers": [
        { "id": "production", "label": "Production disruption", "amount": 68000, "category": "Operations" },
        { "id": "rework", "label": "Scrap and rework", "amount": 41000, "category": "Quality" },
        { "id": "inventory", "label": "Inventory exposure", "amount": 33000, "category": "Inventory" },
        { "id": "supplier", "label": "Supplier expedite", "amount": 24000, "category": "Supply chain" },
        { "id": "engineering", "label": "Engineering and validation", "amount": 18000, "category": "Engineering" }
      ],
      "evidence": [
        { "label": "Similar ECO history", "value": "428 changes", "source": "Teamcenter", "impact": "high" },
        { "label": "Current WIP", "value": "1,280 units", "source": "Opcenter", "impact": "high" },
        { "label": "Supplier lead time", "value": "11 weeks", "source": "ERP", "impact": "medium" }
      ]
    }
  ],
  "disclaimer": "Expected cost represents modeled operational exposure, not approved spend, an accounting accrual, or a guaranteed outcome."
}
